{
  "device": "BQ25798",
  "source": "BQ25798-chapter7.html",
  "register_count": 57,
  "registers": [
    {
      "offset": "0h",
      "name": "REG00_Minimal_System_Voltage",
      "width": 8,
      "reset": "X",
      "description": "Minimal System Voltage",
      "fields": [
        {
          "bit_field": "7-6",
          "name": "RESERVED",
          "access_type": "R/W",
          "reset": "0h",
          "description": "RESERVED"
        },
        {
          "bit_field": "5-0",
          "name": "VSYSMIN_5:0",
          "access_type": "R/W",
          "reset": "X",
          "reset_sources": [
            "REG_RST"
          ],
          "description": "Minimal System Voltage which must be less than VREG in REG01.\nDuring POR, the device reads the resistance tie to PROG pin, to identify the default battery cell count and determine the default power on VSYSMIN list below:\n1s: 3.5V\n2s: 7V\n3s: 9V\n4s: 12V",
          "encoding": {
            "range": "2500mV-16000mV",
            "fixed_offset": "2500mV",
            "bit_step_size": "250mV",
            "clamp": [
              "high"
            ]
          }
        }
      ]
    },
    {
      "offset": "1h",
      "name": "REG01_Charge_Voltage_Limit",
      "width": 16,
      "reset": "X",
      "description": "Charge Voltage Limit",
      "fields": [
        {
          "bit_field": "15-11",
          "name": "RESERVED",
          "access_type": "R",
          "reset": "0h",
          "description": "RESERVED"
        },
        {
          "bit_field": "10-0",
          "name": "VREG_10:0",
          "access_type": "R/W",
          "reset": "X",
          "reset_sources": [
            "REG_RST"
          ],
          "description": "Battery Voltage Limit:\nDuring POR, the device reads the resistance tie to PROG pin, to identify the default battery cell count and determine the default power-on battery voltage regulation limit:\n1s: 4.2V\n2s: 8.4V\n3s: 12.6V\n4s: 16.8V",
          "encoding": {
            "range": "3000mV-18800mV",
            "fixed_offset": "0mV",
            "bit_step_size": "10mV",
            "clamp": [
              "low"
            ]
          }
        }
      ]
    },
    {
      "offset": "3h",
      "name": "REG03_Charge_Current_Limit",
      "width": 16,
      "reset": "X",
      "description": "Charge Current Limit",
      "fields": [
        {
          "bit_field": "15-9",
          "name": "RESERVED",
          "access_type": "R",
          "reset": "0h",
          "description": "RESERVED"
        },
        {
          "bit_field": "8-0",
          "name": "ICHG_8:0",
          "access_type": "R/W",
          "reset": "X",
          "reset_sources": [
            "WATCHDOG",
            "REG_RST"
          ],
          "description": "Charge Current Limit\nDuring POR, the device reads the resistance tie to PROG pin, to identify the default battery cell count and determine the default power-on battery charging current: 1A",
          "encoding": {
            "range": "50mA-5000mA",
            "fixed_offset": "0mA",
            "bit_step_size": "10mA",
            "clamp": [
              "low"
            ]
          }
        }
      ]
    },
    {
      "offset": "5h",
      "name": "REG05_Input_Voltage_Limit",
      "width": 8,
      "reset": "24h",
      "description": "Input Voltage Limit",
      "fields": [
        {
          "bit_field": "7-0",
          "name": "VINDPM_7:0",
          "access_type": "R/W",
          "reset": "24h",
          "description": "Absolute VINDPM Threshold\nVINDPM register is reset to 3600mV upon adapter unplugged and it is set to the value based on the VBUS measurement when the adapter plugs in. It is not reset by the REG_RST and the WATCHDOG",
          "encoding": {
            "por": "3600mV (24h)",
            "range": "3600mV-22000mV",
            "fixed_offset": "0mV",
            "bit_step_size": "100mV",
            "clamp": [
              "low"
            ]
          }
        }
      ]
    },
    {
      "offset": "6h",
      "name": "REG06_Input_Current_Limit",
      "width": 16,
      "reset": "12Ch",
      "description": "Input Current Limit",
      "fields": [
        {
          "bit_field": "15-9",
          "name": "RESERVED",
          "access_type": "R",
          "reset": "0h",
          "description": "RESERVED"
        },
        {
          "bit_field": "8-0",
          "name": "IINDPM_8:0",
          "access_type": "R/W",
          "reset": "12Ch",
          "reset_sources": [
            "REG_RST"
          ],
          "description": "Based on D+/D- detection results:\nUSB SDP = 500mA\nUSB CDP = 1.5A\nUSB DCP = 3.25A\nAdjustable High Voltage DCP = 1.5A\nUnknown Adapter = 3A\nNon-Standard Adapter = 1A/2A/2.1A/2.4A",
          "encoding": {
            "por": "3000mA (12Ch)",
            "range": "100mA-3300mA",
            "fixed_offset": "0mA",
            "bit_step_size": "10mA",
            "clamp": [
              "low"
            ]
          }
        }
      ]
    },
    {
      "offset": "8h",
      "name": "REG08_Precharge_Control",
      "width": 8,
      "reset": "C3h",
      "description": "Precharge Control",
      "fields": [
        {
          "bit_field": "7-6",
          "name": "VBAT_LOWV_1:0",
          "access_type": "R/W",
          "reset": "3h",
          "reset_sources": [
            "REG_RST"
          ],
          "description": "Battery voltage thresholds for the transition from precharge to fast charge, which is defined as a ratio of battery regulation limit (VREG)",
          "values": {
            "0h": "15%*VREG",
            "1h": "62.2%*VREG",
            "2h": "66.7%*VREG",
            "3h": "71.4%*VREG"
          },
          "encoding": {
            "por": "11b"
          }
        },
        {
          "bit_field": "5-0",
          "name": "IPRECHG_5:0",
          "access_type": "R/W",
          "reset": "3h",
          "reset_sources": [
            "WATCHDOG",
            "REG_RST"
          ],
          "description": "Precharge current limit",
          "encoding": {
            "por": "120mA (3h)",
            "range": "40mA-2000mA",
            "fixed_offset": "0mA",
            "bit_step_size": "40mA",
            "clamp": [
              "low"
            ]
          }
        }
      ]
    },
    {
      "offset": "9h",
      "name": "REG09_Termination_Control",
      "width": 8,
      "reset": "5h",
      "description": "Termination Control",
      "fields": [
        {
          "bit_field": "7-7",
          "name": "RESERVED",
          "access_type": "R",
          "reset": "0h",
          "description": "RESERVED"
        },
        {
          "bit_field": "6-6",
          "name": "REG_RST",
          "access_type": "R/W",
          "reset": "0h",
          "description": "Reset registers to default values and reset timer",
          "values": {
            "0h": "Not reset",
            "1h": "Reset"
          },
          "encoding": {
            "por": "0b"
          }
        },
        {
          "bit_field": "5-5",
          "name": "STOP_WD_CHG",
          "access_type": "R/W",
          "reset": "0h",
          "description": "Defines whether a watchdog timer expiration will disable charging",
          "values": {
            "0h": "WD timer expiration keeps existing EN_CHG setting",
            "1h": "WD timer expiration sets EN_CHG=0"
          },
          "encoding": {
            "por": "0b"
          }
        },
        {
          "bit_field": "4-0",
          "name": "ITERM_4:0",
          "access_type": "R/W",
          "reset": "5h",
          "reset_sources": [
            "WATCHDOG",
            "REG_RST"
          ],
          "description": "Termination current",
          "encoding": {
            "por": "200mA (5h)",
            "range": "40mA-1000mA",
            "fixed_offset": "0mA",
            "bit_step_size": "40mA",
            "clamp": [
              "low"
            ]
          }
        }
      ]
    },
    {
      "offset": "Ah",
      "name": "REG0A_Re-charge_Control",
      "width": 8,
      "reset": "X",
      "description": "Re-charge Control",
      "fields": [
        {
          "bit_field": "7-6",
          "name": "CELL_1:0",
          "access_type": "R/W",
          "reset": "X",
          "description": "At POR, the charger reads the PROG pin resistance to determine the battery cell count and update this CELL bits accordingly.",
          "values": {
            "0h": "1s",
            "1h": "2s",
            "2h": "3s",
            "3h": "4s"
          }
        },
        {
          "bit_field": "5-4",
          "name": "TRECHG_1:0",
          "access_type": "R/W",
          "reset": "2h",
          "reset_sources": [
            "WATCHDOG",
            "REG_RST"
          ],
          "description": "Battery recharge deglich time",
          "values": {
            "0h": "64ms",
            "1h": "256ms",
            "2h": "1024ms (default)",
            "3h": "2048ms"
          },
          "encoding": {
            "por": "10b"
          }
        },
        {
          "bit_field": "3-0",
          "name": "VRECHG_3:0",
          "access_type": "R/W",
          "reset": "3h",
          "reset_sources": [
            "WATCHDOG",
            "REG_RST"
          ],
          "description": "Battery Recharge Threshold Offset (Below VREG)",
          "encoding": {
            "por": "200mV (3h)",
            "range": "50mV-800mV",
            "fixed_offset": "50mV",
            "bit_step_size": "50mV"
          }
        }
      ]
    },
    {
      "offset": "Bh",
      "name": "REG0B_VOTG_regulation",
      "width": 16,
      "reset": "DCh",
      "description": "VOTG regulation",
      "fields": [
        {
          "bit_field": "15-11",
          "name": "RESERVED",
          "access_type": "R",
          "reset": "0h",
          "description": "RESERVED"
        },
        {
          "bit_field": "10-0",